{
  "schema_version": "1.0",
  "response_id": "54917daf-61c4-4193-934b-c7c2514bd3b8",
  "pid": "7K3M9QX",
  "study_id": "s2_pilot",
  "wave": 1,
  "occasion_id": "t1",
  "instrument_id": "bscs",
  "instrument_version": "1.0.0",
  "language_version": "bscs.hi-in.v1",
  "block": "X",
  "item_id": "bscs.i02",
  "raw_response": 4,
  "response_latency_ms": 5200.0,
  "administration_mode": "read_aloud",
  "administrator_id": "adm-03",
  "rater_role": "self",
  "rated_pid": null,
  "device_id": "tablet-07",
  "audio_version": "0.1.0",
  "attention_check": false,
  "source": "in_app",
  "recorded_at": "2026-10-21T11:02:00+05:30",
  "supersedes_id": null
}
