{
  "schema_version": "1.0",
  "response_id": "eb38aad8-5282-4d25-8217-582684e890b6",
  "pid": "7K3M9QX",
  "study_id": "s2_pilot",
  "wave": 1,
  "occasion_id": "t1",
  "instrument_id": "partner_rating",
  "instrument_version": "1.0.0",
  "language_version": "partner_rating.hi-in.v1",
  "block": "teamwork",
  "item_id": "partner_rating.i01",
  "raw_response": 4,
  "response_latency_ms": 5200.0,
  "administration_mode": "read_aloud",
  "administrator_id": "adm-03",
  "rater_role": "partner",
  "rated_pid": "9QX7K3M",
  "device_id": "tablet-07",
  "audio_version": "0.1.0",
  "attention_check": false,
  "source": "in_app",
  "recorded_at": "2026-10-21T11:02:00+05:30",
  "supersedes_id": null
}
